{
  "schema_version": "1.0.0",
  "call_id": "4d8f6a2e-1c3b-4e5f-9a7b-2c1d0e3f4a5b",
  "call_type": "ambulance",
  "call_subtype": "traffic_collision",
  "priority": "critical",
  "location": {
    "coordinate_reference": "EPSG:4326",
    "latitude": 31.5198,
    "longitude": 74.3601,
    "intersection_id": "int-07",
    "corridor_id": "corridor-b"
  },
  "geometry_version": "2026-09-18.1",
  "reported_at": "2026-09-18T09:12:00Z",
  "source_reliability": "verified_dispatch",
  "status": "dispatched",
  "truth_label": "simulated"
}
